Seq.,sentence,similarity_to_bench,page,cluster
151,"Looking through the prism of Kotter’s eight-stage process and 
 Schein’s embedding mechanisms, we can gain some insight into what to 
 expect of the most recent efforts.",0.5615585534750028,11,6
152,"
 Sense of Urgency or Culture of Complacency?
 Existing statements and actions to create a sense of urgency, step 1 in 
 Kotter’s change process, are unequivocal. ",0.8084062880097441,11,5
153,"In May 2009, President Obama 
 invoked the specter of trillions of dollars of U.S. debt, the economic crisis, 
 and the GAO’s data on procurement inefficiency to argue his case. ",0.579121018825288,11,4
154,"Dur-
 ing the WSARA signing ceremony, he broadened his reform appeal by 
 claiming it would “better protect our nation, better protect our troops” 
 (Obama, 2009a). ",0.7543585577578731,11,3
155,"The SASC (Weapon Systems, 2009b) recorded similar 
 views in part to increase awareness of the need for reform. ",0.8409742622857906,11,1
156,"Additionally, 
 Secretary Gates (2009) tied his imperative to current missions and those 
 in the future, and taking care of people. ",0.6325993344289979,11,1
157,"His Efficiencies Initiative goals 
 alone add to the sense of urgency—which could not be achieved without 
 change. ",0.7274938134228726,11,6
158,"These statements of urgency, coupled with leadership direction, 
 are routinely passed along to the Defense Acquisition Workforce in offi-
 cial communications and other communications media (Carter, 2010d). ",0.567599744364336,11,1
159,"
 Is this enough to overcome the inertia of the acquisition bureaucracy?",0.3213777072667287,11,3
160,"
 Urgency must overcome complacency. ",0.29458846326246835,11,5
161," The statements 
 and their motivational influence appear compelling, and yet challenges 
 lie in human nature and mixed messages (Kotter, 1996). ",0.49556024331188975,11,5
162,"The Defense 
 Acquisition Workforce is comprised of well-compensated employees with 
 little threat to their employment status. ",0.5148447401539562,11,1
163,"Acquisition professional Dave 
 Frick (2010) noted that the culture of DoD is risk averse and permeates 
 the acquisition community. ",0.5704017627513621,11,6
164,"Such caution about the prospects of program 
 The More Things Change, Acquisition Reform Remains the Same
 110
 ARJ, January 2012, Vol. 19 ",0.6555379568552588,11,3
165,"No. 1 : 099 — 120
 failure reinforces complacency to stick with existing “safe” practices. ",0.44324835074604274,12,5
166,"
 Frick challenged the community to embrace agile acquisition, which 
 requires a culture that encourages risk taking and innovative thinking. ",1.0102167515574443,12,6
167,"
 With no direct cause-and-effect relationship (reward or consequences) 
 between the declared urgency and employment or compensation, a 
 problem that the now-failed National Security Personnel System 
 attempted to address, the declared crisis might be safely ignored as 
 someone else’s problem (Corrin, 2009; Risher, 2010).",0.7566798097581041,12,5
168,"
 Mixed messages can also abet status-quo complacency. ",0.32003381545184817,12,5
169,"In the very 
 address President Obama made when signing WSARA, he stated, “As 
 Commander-in-Chief, I will do whatever it takes to defend the American 
 people, which is why I’ve increased funding for the best military in the 
 history of the world” (Obama, 2009a). ",0.9498568291577634,12,4
170,"He went on to say that waste was 
 unacceptable, but if the United States will indeed cover the cost no mat-
 ter what, how urgent can the situation be? ",0.6019367549912548,12,3
171,"Similar mixed messages are 
 also coming from DoD and the SASC in their management of the F-35 
 program. ",0.5231978261665651,12,1
172,"Recently revealed to be over budget and over schedule again, 
 the high-visibility program has already defied attempted reforms by 
 being “too big to fail” (Martin, 2010). ",0.8872372493755929,12,3
173,"The Senate has also continuously 
 added unrequested money to the budget for a second engine source, 
 which DoD says is not needed (Shalai-Esa, 2010; Wolf, 2010).",0.6740797717691803,12,1
174,"
 Culturally, senior leaders may be failing to embed desired behaviors 
 in the Defense Acquisition Workforce largely through how they react to 
 organizational crises and critical incidents. ",0.6754955308231592,12,6
175,"With acquisition personnel 
 feeling little personal risk and hearing mixed messages, the uninten-
 tional consequence may be that the status quo is not changed. ",0.6236884825927176,12,5
176,"A reviewer 
 noted that this is the heart of the arguments posed by Kotter and Schein. ",0.38662757879056464,12,3
177,"
 While leaders may offer platitudes about organizational goals and objec-
 tives, it is essential that they present clear and compelling statements 
 as to why things must change. ",0.7626404518582112,12,5
178,"Such statements must be accompanied 
 with strategies and the means to enforce accountability. ",0.5184325134977538,12,1
179,"Given a path is 
 established, metrics are essential to transforming the culture of acquisi-
 tion professionals and providing consequences for those who do not get 
 on board. ",0.8652438821937373,12,6
180,"In the Jim Collins “Good to Great” (2001) vernacular—get the 
 wrong people off the bus. ",0.48396775438831546,12,3
181,"Collins noted that great organizations have a 
 culture of rigor and discipline. ",0.4319259153302258,12,5
182,"One business leader exemplar interviewed 
 in his book offered, “You can set your objectives for the year, you can 
 record them in concrete. ",0.7637058320286347,12,5
183,"You can change your plans through the year, but 
 A Publication of the Defense Acquisition University 
 http://www.dau.mil
 111
 ARJ, January 2012, Vol. 19 ",0.6380317207877105,12,0
184,"No. 1 : 099 — 120
 you never change what you measure yourself against” (p. 122). ",1.0562202832173382,13,5
185,"Without 
 clearly expressed metrics and a culture of discipline, the status quo will 
 erode the urgency to change.",0.733726336763052,13,5
186,"
 Guiding coalition or top-down direction? ",0.5160252943522775,13,1
187," The President, the 
 Secretary of Defense along with his USD(AT&L), and two of the more 
 powerful committees of Congress comprise a dream team of sorts. ",0.49900479064734676,13,4
188,"But, 
 does that coalition include enough of the procurement enterprise to 
 complete the transformation called for in acquisition reform? ",0.8346307647388572,13,1
189,"The pace 
 of today’s business environment, in addition to DoD’s size, requires a 
 powerful and empowered coalition in place that can decide, act, and 
 lead as a team (Kotter, 1996). ",0.8622875926409834,13,5
190,"Such an entity does not appear to exist for 
 acquisition reform.",0.5129684942736632,13,3
191,"
 ",0.0,13,-1
192,"An examination of the executive branch’s organizational charts 
 reveals many offices within the White House and DoD with roles in 
 acquisition reform. ",0.5277850416855681,13,4
193,"The challenge is identifying a coherent, empowered, 
 and representative coalition. ",0.5655998450786739,13,5
194,"Instead, guidance and decision making 
 appears to be formulated within the Office of the Secretary of Defense 
 and disseminated through top-down directives. ",0.761273876005635,13,1
195,"This approach risks 
 disempowering many constituents at the next level of “key” players. ",0.5414853543025024,13,5
196,"
 Perceived as part of the problem instead of part of the solution, these 
 powerful leaders are a missing ingredient from Kotter’s change coalition 
 that are essential for success.",0.7276191123315666,13,5
197,"
 Culturally, the current approach appears to miss an opportunity to 
 embed desired behavior. ",0.40762540201564906,13,5
198,"Establishing a guiding coalition gives leaders 
 an opportunity to demonstrate preferences simply by whom they select 
 and how their performance is evaluated. ",0.9353118843643498,13,5
199,"Making more formal use of a 
 guiding coalition could also offer opportunities to exercise role model-
 ing and coaching as a tool for transformation. ",0.8561853313099721,13,5
200,"Michael Kotzian, in his 
 Defense Acquisition Review Journal  award-winning paper (2010, pp. ",0.6143239519132733,13,2
201,"
 158–181), asserted, “the importance of leadership…within DoD’s acqui-
 sition community—is paramount…to overcome the resistance to policy 
 change” (p. 161). ",0.7142296912474927,13,6
202,"Kotzian convincingly argued that while the majority 
 of acquisition reform approaches focused on adjustments to processes 
 and procedures, the critical enabler of change is the Defense Acquisition 
 Workforce. ",0.8221893465700469,13,6
203,"The coalition to effectively guide change must come from 
 within the community of practitioners. ",0.7313704834512034,13,5
204,"Despite the substantial efforts 
 of senior acquisition leaders, there are still concerns with achieving 
 The More Things Change, Acquisition Reform Remains the Same
 112
 ARJ, January 2012, Vol. 19 ",0.8371995423626919,13,6
205,"No. 1 : 099 — 120
 performance, cost, and schedule objectives as documented in the Con-
 gressional Research Service reports on defense acquisition (Chadwick, 
 2007; Schwartz, 2010).",1.0032475878252705,14,1
206,"
 ",0.0,14,-1
207,Vision or decree? ,0.22268657126703195,14,3
208," Slightly different interests motivate each group 
 of potential change agents. ",0.6346037247421675,14,5
209,"The nexus of agreement seems to be the need 
 to execute weapons procurement more efficiently, but beyond that, what 
 vision will motivate change?
 ",0.885810054235893,14,5
210,"According to Kotter, a good vision conveys a picture of what the 
 future will look like, appeals to the long-term interests of stakehold-
 ers, and comprises realistic, attainable goals. ",0.691177764505378,14,5
211,"The Office of Defense 
 Procurement and Acquisition Policy website offers the following vision 
 statement: “Acquisition excellence through leadership with integrity” 
 (Defense Procurement, n.d.). ",0.8159989888952578,14,4
212,This says nothing about reform at all. ,0.7560441747950781,14,3
213,"An 
 unofficial vision statement of sorts has recently appeared, “Do more 
 without more” (Carter, 2010a). ",0.3349201417008292,14,4
214,"Whether this will inspire the workforce 
 though, remains to be seen. ",0.40348127520848637,14,3
215,"It is also unclear what effect was intended by 
 A Publication of the Defense Acquisition University 
 http://www.dau.mil
 113
 ARJ, January 2012, Vol. 19 ",0.43121115283243683,14,0
216,"No. 1 : 099 — 120
 abandoning the term “acquisition reform” in the Efficiencies Initiative, 
 except perhaps to disassociate it from previous failures. ",0.5101640639812108,15,3
217,"One unintended 
 consequence of all three statements, though, could be confusion. ",0.3358381165372683,15,5
218,"Exhor-
 tations for change can become background noise to be ignored by the 
 more complacent members of the organization.",0.571879717412774,15,5
219,"
 Culturally, a clear and compelling vision statement could be used 
 to identify what leadership will pay attention to during the transforma-
 tion. ",0.7811417116343672,15,5
220,"One of Schein’s embedding mechanisms is that leaders are engaged 
 in deliberate role modeling, teaching, and coaching (pp. 240–242). ",0.5577416058420572,15,5
221,"If 
 reform is important, then it should be captured in the vision and part 
 of every formal and informal communication. ",0.6494878607075031,15,5
222,"A few well-thought out 
 sentences could expand on the existing goals to include a general strat-
 egy for getting there: a strategy that could be followed up with metrics 
 to track progress. ",1.056439765283361,15,5
223,"Acquisition senior leaders should seize opportunities 
 to engage in conversations with the Defense Acquisition Workforce and 
 demonstrate through their words and actions that reform is essential.",0.8350282912908079,15,6
224,"
 Empowered change or structural barriers? ",0.6321242440152144,15,5
225," Kotter revealed 
 the impact on change efforts, like acquisition reform, that formal 
 structures and personnel systems can have. ",0.79900221004001,15,6
226,"Stated simply, the way an 
 organization is structured—its rules of behavior or formal processes 
 (Schein’s reinforcing mechanisms) and the incentives inherent in a 
 reward system (embedding mechanisms)—can thwart employees’ 
 intended support of any change effort. ",0.816226883225897,15,5
227,"Without effective embedding 
 mechanisms for acquisition reform, powerful internal and external 
 stakeholder groups are not required or incentivized to assist the change 
 effort. ",0.8301573567046218,15,5
228,"The requirements and budget communities, for example, have 
 unique interests that may not include on-time and on-budget delivery. ",0.8748445822720798,15,5
229,"
 The defense industry itself may also not be inclined to change if it 
 affects profitability. ",0.5628670582840252,15,3
230,"Similarly, prescriptive rules governing program 
 execution can also unintentionally establish their own barriers to 
 change. ",0.8384163015581524,15,5
231,"The 2009 WSARA legislation alone established, in law, detailed 
 rules of program execution in areas such as milestone certification, 
 systems engineering, and competition. ",0.9135974983703079,15,1
232,"Adherence to these new rules is 
 mandatory, and expensive bureaucracy must exist to ensure compliance.",0.8555925606231806,15,5
233,"
 There is also the issue of incentive. ",0.7705771336001946,15,1
234,"Is employee performance in the 
 acquisition community, both military and civilian as well as stakehold-
 ers, evaluated on the basis of acquisition reform goals? ",0.7678722666336122,15,1
235,"Some critics 
 assert that rewards are usually based on achieving the unit mission 
 The More Things Change, Acquisition Reform Remains the Same
 114
 ARJ, January 2012, Vol. 19 ",0.7485750627697629,15,6
236,"No. 1 : 099 — 120
 and may not be tied to acquisition reform outcomes. ",0.5463724079795454,16,3
237,"This can lead to 
 suboptimized performance or even frustration at the employee level or, 
 as Kotter put it, barriers to empowerment.",0.7813330919686003,16,5
238,"
 In “A Ten-Year Review of the Vision for Transforming the Defense 
 Acquisition System,” Rogers and Birmingham (2004, pp. 37–59) noted 
 that DoD acquisitions are subjected to political influence to the point 
 where critics hold there is little hope for real reform. ",0.7322152522973394,16,3
239,"The two authors 
 contend, however, that leaders within the bureaucracy have the pro-
 fessional obligation to drive improvements with clear change visions. ",0.825057212031975,16,5
240,"
 This requires restructuring organizations, processes, and systems to 
 transform the acquisition community. ",0.6584557495381339,16,6
241,"One such structural change is a 
 proposal to institute Acqusition Centers of Excellence to provide effi-
 ciencies through joint (cross-Service) and collaborative effort (Starks, 
 2008, pp. 28–32). ",0.8294591089622426,16,1
242,"The tendency of organizations is to default to reinforc-
 ing mechanisms to change organizational structure—to “rearrange the 
 deck chairs” rather than address the fundamental problems of senior 
 leadership and direction. ",0.8915398534149466,16,6
243,"Program manager Thomas Miller (November–
 December 2010, p. 30) identified root causes as “an unequal distribution 
 of power and influence [combined] with systemic disincentives.” ",0.7139508175795923,16,1
244,"Much 
 needs to be accomplished to refute a RAND study that found “insuffi-
 cient cultural, organizational, and intellectual change in the DoD” and 
 “serious structural and cultural impediments that hinder the ability of 
 the acquisition process to deliver desired outcomes” (Hanks, Axelband, 
 Lindsay, Malik, & Steele, 2005, pp. 67, 142).",0.8568970747557866,16,6
245,"
 A Path to Viable Acquisition Reform
 Sixty years of acquisition reform has yielded a procurement system 
 that requires more reform (GAO, 2011). ",0.787307436912877,16,3
246,"In 2009, President Obama took 
 office and joined forces with the incumbent Secretary of Defense along 
 with an interested and motivated Congress to give it another try. ",0.5443090768622856,16,4
247,"Rec-
 ognizing that the scope and level of effort called for are nothing short of 
 transformational, we selected five elements of Kotter’s eight-stage pro-
 cess for change and used Schein’s concepts of embedding mechanisms for 
 organizational culture to analyze this latest effort’s likelihood of success.",0.8759478501419553,16,5
248,"
 Based on this analysis, the prospects for lasting reform are gloomy. ",0.825918385306123,16,3
249,"
 Efforts to establish a compelling argument for change among the Defense 
 Acquisition Workforce and stakeholders are undercut by mixed messages 
 such as “whatever it takes.” ",0.7955051498621083,16,6
250,"It also does not appear as though an effective 
 A Publication of the Defense Acquisition University 
 http://www.dau.mil
 115
 ARJ, January 2012, Vol. 19 ",0.43883622833739977,16,0
251,"No. 1 : 099 — 120
 guiding coalition or unifying vision exists that can motivate change and 
 embed its ideals into the culture of the acquisition community. ",0.728101570604753,17,6
252,"In addi-
 tion, important barriers to empowerment remain in place.",0.47907297360739326,17,5
253,"
 “Culture isn’t just one aspect of the game –it is 
 the game.” ",0.42030228088734284,17,5
254,"(Gerstner, 2002, p. 182)
 Former IBM Chief Executive Officer Lou Gerstner observed that no 
 enterprise would succeed unless elements of success are embedded in 
 its DNA. ",0.5229615033926679,17,1
255,"To overcome inefficiency in acquisition totaling $296 billion, 
 the ad hoc leadership team needs to go beyond peripheral recognition 
 of the importance of culture change as a component of transformation 
 and instead embrace it as the centerpiece of true reform. ",0.8674959187021267,17,6
256,"Using Schein’s 
 cultural embedding mechanisms, we suggest the following.",0.9353629963190467,17,5
257,"
 DoD should clarify, simplify, and standardize metrics by which it 
 measures success, then pay attention to those metrics and hold people 
 accountable for them. ",0.9154226376935383,17,5
258,"We recommend outcome-based measures that 
 prudently balance performance with schedule and cost. ",1.3067829410479883,17,5
259,"This focus could 
 form the basis for a simple, compelling, and unifying vision such as  DoD 
 Procurement Promised Performance, On Time, On Budget . ",0.987174135899351,17,5
260,"Performance 
 is the sine qua non of acquisition programs; hence, its measures retain 
 prime importance while in tension with factors of schedule and cost. ",1.0572423931552586,17,5
261,"
 Monitoring and adapting performance metrics form the trade space to 
 preserve on-time and on-budget outcomes.",0.9902872863888482,17,5
262,"
 DoD should also formally identify its guiding coalition, recogniz-
 ing that acquisition program outcomes are influenced by stakeholders 
 outside the professional acquisition corps. ",0.7835721392684452,17,5
263,"That coalition should be 
 empowered and used as an embedding mechanism of cultural change: 
 deliberate role modeling, teaching, and coaching; allocation of rewards 
 and status; and recruitment, selection, and promotion. ",0.7066731012735215,17,5
264,"Flag officers and 
 senior civilians, to include those in department and Service-level head-
 quarters, warfighter resource representatives, and support agencies 
 should be included. ",0.9282284997479856,17,1
265,"Recognizing this has the potential to be a large group, 
 a tiered management approach could be used to retain some efficiency 
 while taking advantage of the breadth and depth of the coalition’s reach.",0.7831224783038802,17,5
266,"
 The More Things Change, Acquisition Reform Remains the Same
 116
 ARJ, January 2012, Vol. 19 ",0.6179198284476065,17,3
267,"No. 1 : 099 — 120
 Importantly, using the measures of merit identified above,  all  mem-
 bers of this group should in some way be accountable for the outcomes of 
 the programs in which they have a stake. ",0.7487035974345787,18,5
268,"This action is crucial in pursuit 
 of what Schein calls “cognitive restructuring” (1992, p. 325), where indi-
 viduals become open to new information and ways of thinking. ",0.6103280538900445,18,5
269,"Through 
 broad enforcement of the new standards, this advocacy group will be 
 motivated to set the example that their members can imitate. ",0.6337641650588615,18,5
270,"There, 
 however, is the proverbial rub. ",0.1153567597292501,18,2
271,"Given that many members seek to repre-
 sent the interests of their constituents and can say no with impunity, it is 
 necessary to provide transparency in the process, document dissent, and 
 hold members accountable for their actions as contributors to achieve 
 reform and transformation.",0.9922555125456085,18,5
272,"
 Conclusions
 This article opened with the question, “But, will it all work?” ",0.8050702415917472,18,5
273,"Through 
 an analysis that applied Kotter’s model of organizational change and 
 Schein’s approach to organizational culture and leadership, our conclu-
 sion suggests not. ",0.8933604513897752,18,5
274,Behavioral change is needed to cause transformation. ,0.7353426391408628,18,6
275,"
 Acquisition reforms can be coerced, but will not endure as true transfor-
 mation unless cultural change occurs. ",0.702821329203571,18,5
276,"Success requires commitment to 
 change over simple compliance to superficial rewards and consequences. ",0.7810906607380038,18,5
277,"
 Effective reform requires embedding leadership actions and institutional 
 processes to drive change in the culture of defense acquisition. ",1.1541218528185868,18,6
278,"It is time 
 to undertake a long-term, culturally focused effort to transform DoD’s 
 acquisition process.",0.6408434551947502,18,6
279,"
 A Publication of the Defense Acquisition University 
 http://www.dau.mil
 117
 ARJ, January 2012, Vol. 19 ",0.3541433218257491,18,0
280,"No. 1 : 099 — 120
 Author Biographies
 Col Peter K. eide, UsAF,  is a career 
 acquisition professional, currently serving 
 as Chief of the Simulators Division, Agile 
 Combat Support Directorate, Aeronautical 
 Systems Center, Air Force Materiel Command, 
 Wright-Patterson Air Force Base, Ohio. ",0.7887741431327946,19,2
281,"Col 
 Eide entered the Air Force in 1989 as a 
 graduate from the Air Force Reserve Officer 
 Training Corps program at the University of 
 Wisconsin, Madison. ",0.6460299489951761,19,2
282,"He holds a BS in 
 Electrical Engineering from the University 
 of Wisconsin-Madison, an MSEE from the 
 Air Force Institute of Technology, and a 
 master’s in Strategic Studies from the U.S. 
 Army War College.",0.8218668671750305,19,2
283,"
 (E-mail address: peter.eide@us.af.mil)
 CoL Charles D. Allen, UsA (Ret.) ",0.5180642787731433,19,2
284," is a 
 professor of leadership and cultural studies 
 in the Department of Command, Leadership, 
 and Management at the U.S. Army War Col-
 lege, Carlisle Barracks, PA. ",0.7649043266816485,19,2
285,"He holds a BS 
 from the U.S. Military Academy, an MS in 
 Operations Research from Georgia Tech, an 
 MMAS from the School of Advanced Military 
 Studies, and a master’s in Strategic Studies 
 from the U.S. Army War College.",0.7682108929091944,19,2
286,"
 (E-mail address: charlesd.allen@us.army.mil)",0.5797638068114818,19,2
287,"
  
 The More Things Change, Acquisition Reform Remains the Same
 118
 ARJ, January 2012, Vol. 19 ",0.6179198284476065,19,3
288,"No. 1 : 099 — 120
 References
 Adler, B. (2007, March 20). ",0.3045312700424182,20,0
289,"Procuring failure: Why did Donald Rumsfeld fail at military 
 acquisitions reform? ",0.5911649614749235,20,3
290,The same reasons he failed at everything. ,0.27797550702146095,20,3
291, The American Prospect. ,0.28357224188564173,20,2
292," 
 Retrieved from http://prospect.org/cs/articles?article=procuring_failure#
 Assessment Panel of the Defense Acquisition Performance Assessment Project. ",0.8035093644467071,20,0
293,(2006). ,0.0,20,-1
294,"
 Defense Acquisition Performance Assessment Report. ",0.9214487341730765,20,1
295, Retrieved from https://acc.dau.,0.3213860065552182,20,0
296,"
 mil/CommunityBrowser.aspx?id=32595
 Carter, A. B. (2009). ",0.2843087959636689,20,0
297," Implementation of the Weapon Systems Acquisition Reform Act of 
 2009  [Directive-Type Memorandum 09-027]. ",1.0704327445625348,20,4
298,"Retrieved from http://www.dtic.mil/whs/
 directives/corres/pdf/DTM-09-027.pdf
 Carter, A. B. (2010a). ",0.6126161516098114,20,0
299," Better buying power: Guidance for obtaining greater efficiency and 
 productivity in defense spending  [Memorandum]. ",0.6764947902563943,20,1
300,Retrieved from http://www.acq.osd.,0.334012395485217,20,0
301,"
 mil/docs/usD_ATl_Guidance_Memo_september_14_2010_FiNAl.PDF
 Carter, A. B. (2010b). ",0.48451508537884175,20,0
302," Better buying power: Mandate for restoring affordability and productivity 
 in defense spending  ",0.6963179890824072,20,1
303,[Memorandum]. ,0.37997337068545345,20,4
304,"Retrieved from http://mil-oss.org/resources/us-
 dod_policy-memo_carter-memo-on-defense-spending-28-jun-2010.pdf
 Carter, A. B. (2010c). ",0.6500321943735313,20,0
305," DoD news briefing with Under Secretary Carter with opening remarks by 
 Secretary Gates from the Pentagon. ",0.39061108216332124,20,4
306," Retrieved from http://www.defense.gov/transcripts/
 transcript.aspx?transcriptid=4648
 Carter, A. B. (2010d). ",0.35446050734950557,20,0
307,The Pentagon is serious about saving money [op-ed]. ,0.427174682902108,20,2
