Seq.,sentence,similarity_to_bench,page,cluster
0," A Publication of the Defense Acquisition University 
 http://www.dau.mil
 99
 ARJ, January 2012, Vol. 19 ",0.3541433218257491,1,0
1,"No. 1 : 099 — 120
 image designed by Diane Fleischer  »
 Keywords:  Acquisition Reform, Culture, Leadership, 
 Change, Government Acquisition Process
 The More Things Change, 
 Acquisition Reform 
 Remains the Same
 Col Peter K. Eide, USAF,  
 and COL Charles D. Allen, USA (Ret.)",0.7653001534754802,1,3
2,"
 For over 60 years, the Department of Defense has 
 attempted to fix its weapon systems procurement without 
 success. ",0.6915016991024747,1,1
3,"While notable exceptions emerged during 
 the Global War on Terrorism (i.e., rapid development/
 fielding of Mine Resistant Ambush Protected vehicles and 
 improvised explosive Device defeat systems), “Acqui-
 sition Reform” efforts have not consistently yielded a 
 process/system that delivers products faster, better, or 
 cheaper. ",0.818926289415982,1,1
4,"in 2009, President obama took the initiative 
 to give reforms another try. ",0.6577162198882344,1,4
5,"Through an analysis that 
 applies John P. Kotter’s model of organizational change 
 and edgar H. schein’s approach to organizational culture 
 and leadership, the conclusion suggests that current 
 initiatives will not be successful. ",1.0891786915690553,1,6
6,"Behavioral change is 
 needed to embed transformation. ",0.7161632541805854,1,6
7,"Acquisition reforms 
 can be coerced, but will not endure as true transforma-
 tion unless cultural change occurs.",0.7134612264499872,1,5
8,"
 Acquisition
 Reform
 A Publication of the Defense Acquisition University 
 http://www.dau.mil
 101
 ARJ, January 2012, Vol. 19 ",0.4341160825073684,1,0
9,"No. 1 : 099 — 120
 In March of 2009, shortly after Barack Obama was sworn in as 
 President, the Government Accountability Office (GAO) released its 
 annual report “Defense Acquisitions: Assessments of Selected Weap-
 ons Programs” (GAO, 2009). ",0.7675563660802381,3,4
10,"Cumulative cost growth among assessed 
 Department of Defense (DoD) programs had reached $296 billion. ",0.8643002855766148,3,1
11,"That 
 latest revelation of inefficiency provided a rallying point for senior lead-
 ers in the White House, Congress, and DoD.
 The GAO report was released as significant forces for change were 
 beginning to move in the same direction. ",0.8517436145233571,3,4
12,"President Obama declared his 
 commitment to reduce the federal deficit by half in 4 years as Congress 
 made final changes on legislation aimed at acquisition reform (Phillips, 
 2009). ",0.854960575597621,3,4
13,"Concurrently, Secretary of Defense Robert Gates espoused his 
 own imperatives for acquisition reform (Gates, 2009), and hired a simi-
 larly motivated Under Secretary of Defense for Acquisition, Technology 
 & Logistics (USD[AT&L]), Dr. Ashton Carter (Hearing, 2009). ",0.5963686266024377,3,4
14,"Together, 
 these leaders emerged as a powerful coalition of change agents to fix the 
 government’s acquisition process.",0.7998732309275544,3,5
15,"
 But, will it all work? ",0.4768802040790748,3,5
16,"In  Leading Change , John P. Kotter (1996) pos-
 ited primary reasons why transformations fail. ",0.5728465157540119,3,5
17,"Closely related, Schein’s 
 (1992) seminal work on organizational culture emphasized the need for 
 behavioral change to drive transformation. ",0.8392630192733525,3,6
18,"Both approaches are pre-
 sented as a framework for assessing the likelihood of success for current 
 acquisition reform. ",0.7070902970555886,3,6
19,"The prognosis for effective reform is dim without 
 embedding leadership actions and institutional processes that will drive 
 change in the culture of defense acquisition. ",1.0101990862848602,3,6
20,"Without such intentionality, 
 one can expect to repeat the history of unfulfilled mandates for reform.",0.7155230327783408,3,3
21,"
 ",0.0,3,-1
22,"A Brief History of Acquisition Reform
 The need to fix, or reform, the DoD’s various acquisition processes 
 is almost universally acknowledged. ",0.8683877560373543,3,3
23,"Numerous studies have informed 
 U.S. strategic leaders on its shortcomings since 1949 (Assessment Panel, 
 2006). ",0.9224691687774269,3,1
24,"The following summary of acquisition reform initiatives since 
 the 1980s provides context for an analysis of initiatives undertaken 
 since 2009.",0.905406012697851,3,1
25,"
 The More Things Change, Acquisition Reform Remains the Same
 102
 ARJ, January 2012, Vol. 19 ",0.6179198284476065,3,3
26,"No. 1 : 099 — 120
 The Scandalous 1980s
 ",0.0,4,-1
27,"The first half of the decade of the eighties, marked by “fraud, waste, 
 and abuse” scandals in the procurement system, led to calls for reform 
 (Parlier, 1989). ",0.547370491716746,4,3
28,"In response, President Reagan created a Blue Ribbon 
 Commission on Defense Management, also known as the Packard 
 Commission, which produced what came to be known as the “Packard 
 Report.” ",0.6010322346412216,4,4
29,"Congress also worked its own legislative reforms to include the 
 Goldwater-Nichols Department of Defense Reorganization Act of 1986. ",0.9215953692546818,4,4
30,"
 The Blue Ribbon Commission final report stated flatly, “Excellence in 
 defense management will not and cannot emerge by legislation or direc-
 tive” (President’s Blue Ribbon Commission, 1986, p. xii). ",0.6298408272512843,4,4
31,"The commission 
 believed that acquisition employees at all levels must be encouraged and 
 empowered to succeed, and that Congress, DoD, and industry must all set 
 aside parochialism and “restore a sense of shared purpose and mutual 
 confidence” (p. xii). ",0.7659056309311095,4,1
32,"The Packard Report recommended specific ways 
 in which Congress and DoD could improve program stability to mirror 
 successful industry practices. ",1.0151381763693637,4,6
33,"Some of the specific commission recom-
 mendations became codified into law.",0.7663399655058458,4,4
34,"
 ",0.0,4,-1
35,"The Goldwater-Nichols Act of 1986 contained a major restructur-
 ing of DoD, to include changes that partially addressed the Blue Ribbon 
 Commission’s findings of diluted authority for execution. ",0.9520863758970358,4,1
36,"Accordingly, 
 the 99th Congress, with the National Defense Authorization Act for Fis-
 cal Year 1987, directed consolidation of the acquisition function within 
 the offices of the Service secretaries. ",0.818100318014881,4,4
37,"Other legislation that year included 
 clarification of roles and responsibilities of the newly created position of 
 the Under Secretary of Defense for Acquisition.",0.6599762241570583,4,4
38,"
 A More Business-Minded 1990s
 The nineties saw further application of reform initiatives originally 
 recommended by the Packard Commission. ",0.8567926363543642,4,3
39,"The Defense Acquisition 
 Workforce Improvement Act (DAWIA) of 1990 addressed the need to 
 improve the quality of the acquisition workforce, establishing formal 
 career paths and standards for education and training. ",1.373008596792016,4,1
40,"Following his 
 inauguration in 1993, President Clinton also signed two reforms into 
 law. ",0.8717591213451743,4,4
41,"The Federal Acquisition Streamlining Act of 1994 exempted pro-
 curement of commercial items from existing laws and expanded the 
 definition of “commercial product” to broaden its applicability. ",0.9074426168006239,4,1
42,"The 
 Clinger-Cohen Act of 1996 eliminated cost accounting standards that 
 had discouraged commercial companies from doing business with the 
 A Publication of the Defense Acquisition University 
 http://www.dau.mil
 103
 ARJ, January 2012, Vol. 19 ",0.8510408955200726,4,0
43,"No. 1 : 099 — 120
 federal government. ",0.4913367275216806,5,4
44,"Both reforms addressed the Blue Ribbon Commis-
 sion’s findings that a reduction in government red tape and commercial 
 innovation was key to improved acquisition outcomes.",0.8991070500317917,5,1
45,"
 William Perry, a commission member, became Secretary of Defense 
 in 1994 and initiated the most severe reforms with the famous “Perry 
 Memo” (1994). ",0.6109019398465244,5,4
46,"Perry directed the armed services to use commercial 
 specifications and standards when contracting for goods and services 
 instead of the index of military specifications and standards then in 
 existence. ",0.7905797298036135,5,1
47,"Perry also mandated Integrated Product and Process Develop-
 ment (IPPD) and Integrated Product Teams (IPTs) to manage program 
 execution. ",0.9503896868089328,5,6
48,"Cost as an independent variable (CAIV) would be used to 
 contain cost growth. ",0.7956252213422806,5,5
49,"Advanced Concept Technology Demonstrations 
 would also employ prototypes to reduce risk and maximize operational 
 utility of new weapon systems (Carter & White, 2000).",0.7512209841179185,5,1
50,"
 In 1997, Secretary of Defense William Cohen undertook a series of 
 additional acquisition reforms under the umbrella of “Defense Reform 
 Initiative (DRI).” ",0.7421600752616222,5,4
51,"His DRI Report identified four areas, or pillars, of 
 reform: Reengineer – adopt modern business practices; Consolidate 
 – streamline organizations to eliminate redundancy and maximize 
 synergy; Compete – apply market mechanisms to improve quality and 
 reduce costs; and Eliminate – reduce excess support structures to free 
 resources and focus on core competencies (Cohen, 1997). ",1.3296017849289496,5,6
52,"DRI was largely 
 a continuation of themes introduced by the Blue Ribbon Commission.",0.5488331489308195,5,4
53,"
 New Century, Old Problems—2000–2005
 With the turn of the century, the Revolution in Military Affairs also 
 called for a concurrent Revolution in Business Affairs. ",0.4816704907694463,5,3
54,"With the experi-
 ence gained since his 1997 appointment, Under Secretary of Defense for 
 Acquisition, Technology, and Logistics (USD[AT&L]) ",0.49552714485283716,5,4
55,"Jacques Gansler 
 put forth a new path for the new century through acquisition reform 
 in response to studies directed by Congress. ",0.7916529030080091,5,4
56,"He noted three clear “top 
 line” goals: reduce cycle times for the development and delivery of new 
 weapon systems; reduce total ownership costs; and right-size the Defense 
 Acquisition Workforce and infrastructure to realize savings through 
 efficiencies, and maximize flexibility in the new business environment 
 (Gansler, 2000). ",0.9683778076929838,5,6
57,"Efforts included increasing reliance on an integrated 
 civil-military industrial base, focus on cost and schedule as priority 
 parameters over performance, and necessary training of the Defense 
 Acquisition Workforce on commercial practices.",1.336368199100758,5,6
58,"
 The More Things Change, Acquisition Reform Remains the Same
 104
 ARJ, January 2012, Vol. 19 ",0.6179198284476065,5,3
59,"No. 1 : 099 — 120
 With his second appointment as Secretary of Defense, Donald H. 
 Rumsfeld brought his own business-minded approach to transforma-
 tion. ",0.38389882829477706,6,4
60,"For Secretary Rumsfeld, buying the right thing was as important 
 as buying it right, and transformational, network-centric capabilities 
 were more important to future conflict than legacy systems (Adler, 
 2007). ",0.6261083276997251,6,1
61,"Following a business-like approach, Rumsfeld sought innovation 
 capabilities from nontraditional defense industries.",0.6898631958197932,6,1
62,"
 Are We There Yet?—2005 to Present
 ",0.2852404756819965,6,5
63,"Despite the extensive reform efforts, by 2005 DoD and Congressional 
 leadership as well as President George W. Bush lost confidence in the 
 acquisition system (Assessment Panel, 2006). ",0.8910136601523838,6,4
64,"On June 7, 2005, Acting 
 Deputy Secretary of Defense Gordon England established the Defense 
 Acquisition Performance Assessment (DAPA) Project to conduct a 
 sweeping and integrated assessment of “every aspect” of acquisition. ",1.003375385156055,6,4
65,"
 DAPA’s major findings included recognition that the industrial base had 
 consolidated significantly since the mid-eighties and that the nature of 
 the post-Cold War security environment placed a premium on flexibility 
 and technological exploitation. ",0.6987958471921325,6,1
66,"DAPA, like previous efforts, identified 
 excessive oversight and complex acquisition processes as cost and 
 schedule drivers, and called for stability of requirements as an essential 
 element for an effective acquisition system.",1.0500570880902165,6,6
67,"
 ",0.0,6,-1
68,"The history of acquisition reform reflects much has been done to 
 study the problem, identify candidate solutions, and execute reforms, 
 only to return to the conclusion that more reform is needed. ",1.297262686419001,6,6
69,"The most 
 recent acquisition reform initiatives of the Obama Administration and 
 the 111th Congress followed suit.",0.7213771105167122,6,4
70,"
 Acquisition Reform in 80 Days
 Secretary of Defense Robert Gates (2009) offered his own convic-
 tions regarding the need for acquisition reform. ",0.6162523646959963,6,4
71,"“We must reform how 
 and what we buy,” he said in his fiscal year 2010 budget recommendation, 
 “meaning a fundamental overhaul of our approach to procurement acqui-
 sition and contracting.” ",0.9139984138816395,6,1
72,"Like President Obama, Gates pulled no punches 
 in his characterization of the breadth and depth needed for acquisition 
 reform. ",0.5835923677102269,6,4
73,"He asserted that dramatic change would be required in order 
 to maintain U.S. military superiority in an environment of shrinking 
 economic resources.",1.0011648275886516,6,5
74,"
 A Publication of the Defense Acquisition University 
 http://www.dau.mil
 105
 ARJ, January 2012, Vol. 19 ",0.3541433218257491,6,0
75,"No. 1 : 099 — 120
 Secretary Gates identified three fundamental steps to accomplish 
 needed reform. ",0.842837600870863,7,1
76,"First, senior leaders must demonstrate commitment and 
 courage to discontinue programs that are either failing or procuring more 
 capability than was needed. ",0.7378241714548863,7,5
77,"Second, performance requirements should be 
 scrutinized and, as necessary, limited to avoid cost and schedule overruns 
 while procuring what is technically feasible. ",1.3862529006352005,7,5
78,"Finally, government program 
 teams should be adequately staffed for proper oversight, cost estimates 
 should be more realistic, and budgets protected for program stability.",1.2413510789949898,7,5
79,"
 Like President Obama, Secretary Gates recognized the challenge 
 in leading acquisition reform. ",0.513232183735938,7,4
80,"It, however, is one thing for the executive 
 branch to agree and another to work with other stakeholders to make 
 The More Things Change, Acquisition Reform Remains the Same
 106
 ARJ, January 2012, Vol. 19 ",0.8175140058298795,7,3
81,"No. 1 : 099 — 120
 tough decisions on specific programs. ",0.5216131905814092,8,5
82,"“To do this,” he said, “the President 
 and I look forward to working with the Congress, industry, and many 
 others” (Gates, 2009).",0.45611749922762906,8,4
83,"
 On May 20, 2009, Senator John McCain issued a floor statement in 
 support of the U.S. Senate Armed Service Committee (SASC)’s Weapon 
 Systems Acquisition Reform Act (Weapon Systems, 2009a), which would 
 be signed into law just two days later. ",0.8727573902371389,8,4
84,"WSARA was as important for its 
 substance as it was for the demonstration of bipartisanship (McCain, 
 2009). ",0.43911280248381046,8,3
85,"Congress was united in its pursuit of acquisition reform and in 
 concert with similar efforts of the President and within DoD, as codified 
 in Department of Defense Instruction 5000.2 (DoD, 2008).",0.7888401169995259,8,4
86,"
 ",0.0,8,-1
87,"The principal aim of WSARA was to improve the likelihood of suc-
 cess of major program acquisitions by focusing on decisions at their 
 inception. ",0.7936162434479176,8,6
88,"WSARA reforms seek reliable and independent baseline cost 
 estimates, rigorous early developmental testing and systems engineering 
 oversight, and strong gatekeeping to prevent programs from proceeding 
 with too much risk of immature technology. ",1.1845278906761985,8,1
89,"The goal of early risk reduc-
 tion sought to facilitate the expanded use of fixed price contracts. ",1.0724123634463214,8,5
90,"Like 
 the President, Congress also called for increased use of competition in 
 WSARA to reduce costs.",1.0888588934670724,8,3
91,"
 A final WSARA reform of note was a strengthening of the “Nunn-
 McCurdy” process. ",0.6766586610578227,8,4
92,"Nunn-McCurdy provisions require DoD to report to 
 Congress when cost growth on a major program breaches a critical cost 
 growth threshold. ",1.0244234418731444,8,1
93,"Characterized by Senator McCain as “a big stick … to 
 wield against the very worst performing programs,” the new legislation 
 required a root-cause assessment of failing programs and presumed 
 program termination within 60 days of notification unless DoD certified 
 in writing to the contrary.",0.8836852041319535,8,3
94,"
 Within the first 80 days of the new presidential administration, key 
 senior leaders in the executive and legislative branches of government 
 united their visions and efforts to re-ignite a transformation of DoD 
 weapons systems procurement. ",0.7238613150408557,8,1
95,"OMB subsequently issued numerous 
 directives (Field, 2009a; 2009b; Gordon, 2009; Orszag, 2009a) as execu-
 tive branch guidelines. ",0.6859404046603603,8,4
96,"Moreover, as the year ended, Under Secretary 
 Dr. Ashton Carter signed out a “Directive-Type Memorandum” (2009) 
 containing WSARA implementation instructions. ",0.830857494009597,8,4
97,"Acquisition reform 
 in the new century did not stop there.",0.6818397831930213,8,3
98,"
 A Publication of the Defense Acquisition University 
 http://www.dau.mil
 107
 ARJ, January 2012, Vol. 19 ",0.3541433218257491,8,0
99,"No. 1 : 099 — 120
 In Search of Efficiency
 On the 65th anniversary of Allied victory in Europe, Secretary Gates 
 spoke publicly on defense spending. ",0.4716223631739086,9,2
100,"Calling upon the memory of Presi-
 dent Eisenhower’s leadership while in office, Secretary Gates agreed, 
 “the U.S. should spend as much as necessary on national defense—but 
 not a penny more” (Gates, 2010). ",0.6279608798778761,9,4
101,"He then went on to recognize that while 
 the continuing demands of the military would require real growth in the 
 defense budget of 2 to 3 percent annually, domestic economic pressures 
 made that level of fiscal support unlikely. ",0.9215667770490323,9,1
102,"Gates concluded that DoD must 
 pursue an Efficiencies Initiative to sustain the necessary growth without 
 commensurate budget increases.",1.1191432902910456,9,1
103,"
 Secretary Gates and Under Secretary Carter asserted that their Effi-
 ciencies Initiative was different from acquisition reform, but key aspects 
 of the initiative constitute a clear continuation of the transformation 
 begun the previous year (Carter, 2010c). ",0.729900828294566,9,3
104,"Objectives included calls for: 
 delivering systems within budget; getting better buying power; restoring 
 affordability programs; removing government impediments to leanness; 
 and avoiding program turbulence. ",1.0531314773246376,9,1
105,"In a subsequent memorandum, Under 
 Secretary Carter endorsed a claim that two-thirds of the savings could 
 be found within existing programs by conducting them more efficiently 
 and affordably (Carter, 2010b). ",0.7025574078476349,9,4
106,"Also noting that roughly half of the nearly 
 $700 billion invested each year on defense is contracted-out, the initia-
 tive also seeks to improve industry productivity. ",0.612397424546206,9,1
107,"Once again, there was 
 recognition that change would be difficult and take time. ",0.6443895941049987,9,5
108,"Further, a total 
 team effort that now included industry would be required.",0.9138730657957491,9,5
109,"
 Under Secretary Carter provided detailed implementation guidance 
 to acquisition professionals in separate memos issued in September and 
 November of 2010 (Carter, 2010a; 2010b). ",0.825630021849967,9,4
110,"These memos culminated 21 
 months of acquisition reform since being sworn in. ",0.49521702693639885,9,4
111,"It is now appropriate 
 to ask the question: Will this latest attempt at acquisition reform succeed 
 where 60 years of effort have failed? ",0.5831655876734634,9,3
112,"One framework for analysis comes 
 from the organizational change and culture models of Kotter and Schein 
 (Kotter, 1996; Schein, 1992).",0.8517282422883861,9,6
113,"
 Why transformations fail. ",0.26107814562111686,9,5
114," John P. Kotter (1996) approached his 
 research by asking why transformation efforts fail. ",0.5455784883420333,9,3
115,"He concluded that 
 eight fundamental errors can thwart success. ",0.7028523700777966,9,5
116,"Using these, he developed 
 an eight-stage process to create major change. ",0.8961431940196944,9,5
117,"This article focuses on the 
 first five, which are foundational to success.",0.667439888732142,9,6
118,"
 The More Things Change, Acquisition Reform Remains the Same
 108
 ARJ, January 2012, Vol. 19 ",0.6179198284476065,9,3
119,"No. 1 : 099 — 120
 Error No. 1: Allowing too much complacency. ",0.29868666562214535,10,5
120," Establishing a sense 
 of urgency is critical to gaining needed cooperation, and the first stage in 
 Kotter’s change process. ",0.9477181945732116,10,5
121,"Without urgency, members of the organization 
 are unlikely to part with old, comfortable ways of doing business. ",0.4938755146910243,10,5
122,"The ur-
 gency must clearly demonstrate that the personal cost of not changing is 
 higher than that of the change being requested. ",1.051236381447129,10,5
123,"The continued existence 
 of the organization and loss of one’s job are good examples.",0.7694029154977824,10,5
124,"
 Error No. 2: Failure to create a sufficiently powerful guiding co-
 alition. ",0.5388970766569415,10,5
125, The second step is creating the guiding coalition. ,0.533605545878678,10,5
126,"This step 
 recognizes the fact that no single person can accomplish steps 3 through 
 8 single-handedly. ",0.5204148522024014,10,5
127,"Building a trusted team of powerful, expert, and cred-
 ible leaders is essential early in the process.",0.7192675542465921,10,5
128,"
 Error No. 3: Underestimating the power of vision. ",0.3267943125558969,10,3
129," Next, success-
 ful change requires developing a vision and a strategy. ",1.0290017456720035,10,6
130,"Compared to 
 authoritarian decrees or micromanagement, Kotter believes that vision 
 has the power to break through forces that support the status quo. ",0.48054885221143573,10,5
131,"Vision 
 provides an image of the future that includes the inherent reason for its 
 goodness. ",0.8009555465661169,10,5
132,"Good vision simplifies, motivates, and organizes.",0.8132136083407353,10,5
133,"
 Error No. 4: Undercommunicating the vision. ",0.2576961116675574,10,3
134," Communicating the 
 vision is step 4 of the process. ",0.5084387114249721,10,5
135,"Elements for successful visioning include 
 simplicity of message, multiple forums for communication, and expla-
 nation of seeming inconsistencies. ",0.5831548415039566,10,5
136,"Most importantly, repetition of the 
 message by leaders is essential. ",0.5066943040915253,10,5
137,"Repeating the vision not only ensures the 
 message is received, but also underscores its importance.",0.4162475911348253,10,5
138,"
 Error No. 5: Permitting obstacles to block the new vision. ",0.38892620909404674,10,5
139," Once the 
 leadership team successfully conveys a sense of urgency and vision, or-
 ganizational members should be empowered for broad-based action. ",0.7946842066377235,10,5
140,"This 
 fifth step recognizes that members who support change may encounter 
 barriers to action. ",0.794926258189446,10,5
141,"These can be structural impediments, lack of skills, 
 bad supervisors, or organizational systems and processes processes that 
 get in the way. ",0.5933952787437872,10,5
142,Removing these barriers will facilitate culture change.,0.876913532724987,10,5
143,"
 How to change culture. ",0.7898383256280632,10,5
144," In  Organizational Culture and 
 Leadership,  Schein (1992, pp. 230–245) described how leaders use 
 primary embedding mechanisms to create or change an organizational 
 climate. ",0.9737775840166167,10,6
145,"Embedding mechanisms teach members of an organization 
 how to perceive, think, feel, and behave in accordance with the desired 
 A Publication of the Defense Acquisition University 
 http://www.dau.mil
 109
 ARJ, January 2012, Vol. 19 ",0.5822042654457064,10,3
146,"No. 1 : 099 — 120
 transformational outcome. ",0.3885884253272809,11,5
147,"The primary mechanisms are: what leaders 
 pay attention to, measure, and control on a regular basis; how leaders 
 react to critical incidents and organizational crises; how leaders allocate 
 resources; deliberate role modeling, teaching, and coaching; how leaders 
 allocate rewards and status; and how leaders recruit, select, promote, 
 and excommunicate members. ",0.993378519857549,11,5
148,"Through these mechanisms, leaders 
 demonstrate, through their own behavior, what is important. ",0.5509619226413626,11,5
149,"Together, 
 the models of Kotter and Schein provide a framework for analysis of the 
 current acquisition reform efforts.",0.8819115032953428,11,6
150,"
 Likelihood of Success
 Historically, acquisition reform has failed to achieve stated goals and 
 objectives. ",0.6679870232428804,11,6
